{
  "schema_version": "market_intel.a_share_charts.v1",
  "publication": "public",
  "report_id": "2026-09-30-evening",
  "date": "2026-09-30",
  "kind": "evening",
  "generated_at": "2026-09-30T19:27:42.776518+08:00",
  "charts": [
    {
      "key": "dashboard",
      "title": "综合仪表盘",
      "status": "degraded",
      "reason": "融资余额最新观测日早于上一交易日，保留原始观测日",
      "points": [
        {
          "label": "上涨家数",
          "value": 2567.0,
          "unit": "家",
          "observation_date": "2026-09-30",
          "source_label": "Tushare A 股日线",
          "source_url": "https://tushare.pro/document/1?doc_id=27"
        },
        {
          "label": "下跌家数",
          "value": 2824.0,
          "unit": "家",
          "observation_date": "2026-09-30",
          "source_label": "Tushare A 股日线",
          "source_url": "https://tushare.pro/document/1?doc_id=27"
        },
        {
          "label": "平盘家数",
          "value": 170.0,
          "unit": "家",
          "observation_date": "2026-09-30",
          "source_label": "Tushare A 股日线",
          "source_url": "https://tushare.pro/document/1?doc_id=27"
        },
        {
          "label": "平均涨跌",
          "value": -0.08075288617155191,
          "unit": "%",
          "observation_date": "2026-09-30",
          "source_label": "Tushare A 股日线",
          "source_url": "https://tushare.pro/document/1?doc_id=27"
        },
        {
          "label": "涨停家数",
          "value": 56.0,
          "unit": "家",
          "observation_date": "2026-09-30",
          "source_label": "Tushare 涨跌停榜单",
          "source_url": "https://tushare.pro/document/2?doc_id=355"
        },
        {
          "label": "最高连板",
          "value": 7.0,
          "unit": "板",
          "observation_date": "2026-09-30",
          "source_label": "Tushare 连板天梯",
          "source_url": "https://tushare.pro/document/2?doc_id=356"
        },
        {
          "label": "成交额 2026-09-23",
          "value": 17831.282616870798,
          "unit": "亿",
          "observation_date": "2026-09-23",
          "source_label": "Tushare A 股日线",
          "source_url": "https://tushare.pro/document/1?doc_id=27"
        },
        {
          "label": "成交额 2026-09-24",
          "value": 16691.122742519998,
          "unit": "亿",
          "observation_date": "2026-09-24",
          "source_label": "Tushare A 股日线",
          "source_url": "https://tushare.pro/document/1?doc_id=27"
        },
        {
          "label": "成交额 2026-09-28",
          "value": 17167.1221811513,
          "unit": "亿",
          "observation_date": "2026-09-28",
          "source_label": "Tushare A 股日线",
          "source_url": "https://tushare.pro/document/1?doc_id=27"
        },
        {
          "label": "成交额 2026-09-29",
          "value": 14215.963248383401,
          "unit": "亿",
          "observation_date": "2026-09-29",
          "source_label": "Tushare A 股日线",
          "source_url": "https://tushare.pro/document/1?doc_id=27"
        },
        {
          "label": "成交额 2026-09-30",
          "value": 14500.7741309921,
          "unit": "亿",
          "observation_date": "2026-09-30",
          "source_label": "Tushare A 股日线",
          "source_url": "https://tushare.pro/document/1?doc_id=27"
        },
        {
          "label": "融资余额 2026-09-07",
          "value": 13478.85032867,
          "unit": "亿",
          "observation_date": "2026-09-07",
          "source_label": "Tushare 融资融券交易汇总",
          "source_url": "https://tushare.pro/document/2?doc_id=58"
        },
        {
          "label": "融资余额 2026-09-08",
          "value": 13483.62147444,
          "unit": "亿",
          "observation_date": "2026-09-08",
          "source_label": "Tushare 融资融券交易汇总",
          "source_url": "https://tushare.pro/document/2?doc_id=58"
        },
        {
          "label": "融资余额 2026-09-09",
          "value": 13462.41123301,
          "unit": "亿",
          "observation_date": "2026-09-09",
          "source_label": "Tushare 融资融券交易汇总",
          "source_url": "https://tushare.pro/document/2?doc_id=58"
        },
        {
          "label": "融资余额 2026-09-14",
          "value": 13366.90755322,
          "unit": "亿",
          "observation_date": "2026-09-14",
          "source_label": "Tushare 融资融券交易汇总",
          "source_url": "https://tushare.pro/document/2?doc_id=58"
        },
        {
          "label": "融资余额 2026-09-24",
          "value": 13318.41736225,
          "unit": "亿",
          "observation_date": "2026-09-24",
          "source_label": "Tushare 融资融券交易汇总",
          "source_url": "https://tushare.pro/document/2?doc_id=58"
        }
      ]
    },
    {
      "key": "moneyflow",
      "title": "资金流向图",
      "status": "ok",
      "reason": null,
      "points": [
        {
          "label": "宁德时代 300750",
          "value": 12.41,
          "unit": "亿元",
          "observation_date": "2026-09-30",
          "source_label": "Tushare 同花顺资金流",
          "source_url": "https://tushare.pro/document/2?doc_id=348"
        },
        {
          "label": "万科A 000002",
          "value": 10.56,
          "unit": "亿元",
          "observation_date": "2026-09-30",
          "source_label": "Tushare 同花顺资金流",
          "source_url": "https://tushare.pro/document/2?doc_id=348"
        },
        {
          "label": "药明康德 603259",
          "value": 8.56,
          "unit": "亿元",
          "observation_date": "2026-09-30",
          "source_label": "Tushare 同花顺资金流",
          "source_url": "https://tushare.pro/document/2?doc_id=348"
        },
        {
          "label": "我爱我家 000560",
          "value": 7.74,
          "unit": "亿元",
          "observation_date": "2026-09-30",
          "source_label": "Tushare 同花顺资金流",
          "source_url": "https://tushare.pro/document/2?doc_id=348"
        },
        {
          "label": "恒瑞医药 600276",
          "value": 6.27,
          "unit": "亿元",
          "observation_date": "2026-09-30",
          "source_label": "Tushare 同花顺资金流",
          "source_url": "https://tushare.pro/document/2?doc_id=348"
        },
        {
          "label": "贵州茅台 600519",
          "value": 6.19,
          "unit": "亿元",
          "observation_date": "2026-09-30",
          "source_label": "Tushare 同花顺资金流",
          "source_url": "https://tushare.pro/document/2?doc_id=348"
        },
        {
          "label": "工商银行 601398",
          "value": 5.85,
          "unit": "亿元",
          "observation_date": "2026-09-30",
          "source_label": "Tushare 同花顺资金流",
          "source_url": "https://tushare.pro/document/2?doc_id=348"
        },
        {
          "label": "交通银行 601328",
          "value": 4.94,
          "unit": "亿元",
          "observation_date": "2026-09-30",
          "source_label": "Tushare 同花顺资金流",
          "source_url": "https://tushare.pro/document/2?doc_id=348"
        },
        {
          "label": "兆易创新 603986",
          "value": -16.29,
          "unit": "亿元",
          "observation_date": "2026-09-30",
          "source_label": "Tushare 同花顺资金流",
          "source_url": "https://tushare.pro/document/2?doc_id=348"
        },
        {
          "label": "通富微电 002156",
          "value": -10.23,
          "unit": "亿元",
          "observation_date": "2026-09-30",
          "source_label": "Tushare 同花顺资金流",
          "source_url": "https://tushare.pro/document/2?doc_id=348"
        },
        {
          "label": "中际旭创 300308",
          "value": -8.86999999,
          "unit": "亿元",
          "observation_date": "2026-09-30",
          "source_label": "Tushare 同花顺资金流",
          "source_url": "https://tushare.pro/document/2?doc_id=348"
        },
        {
          "label": "亨通光电 600487",
          "value": -7.916036999999999,
          "unit": "亿元",
          "observation_date": "2026-09-30",
          "source_label": "Tushare 同花顺资金流",
          "source_url": "https://tushare.pro/document/2?doc_id=348"
        },
        {
          "label": "长鑫科技 688825",
          "value": -7.744619,
          "unit": "亿元",
          "observation_date": "2026-09-30",
          "source_label": "Tushare 同花顺资金流",
          "source_url": "https://tushare.pro/document/2?doc_id=348"
        }
      ]
    },
    {
      "key": "topic",
      "title": "热点概念图",
      "status": "ok",
      "reason": null,
      "points": [
        {
          "label": "mRNA概念",
          "value": 6.42,
          "unit": "%",
          "observation_date": "2026-09-30",
          "source_label": "东方财富概念板块（Tushare 授权数据）",
          "source_url": "https://data.eastmoney.com/bkzj/"
        },
        {
          "label": "重组蛋白",
          "value": 4.51,
          "unit": "%",
          "observation_date": "2026-09-30",
          "source_label": "东方财富概念板块（Tushare 授权数据）",
          "source_url": "https://data.eastmoney.com/bkzj/"
        },
        {
          "label": "玉米",
          "value": 4.09,
          "unit": "%",
          "observation_date": "2026-09-30",
          "source_label": "东方财富概念板块（Tushare 授权数据）",
          "source_url": "https://data.eastmoney.com/bkzj/"
        },
        {
          "label": "转基因",
          "value": 3.46,
          "unit": "%",
          "observation_date": "2026-09-30",
          "source_label": "东方财富概念板块（Tushare 授权数据）",
          "source_url": "https://data.eastmoney.com/bkzj/"
        },
        {
          "label": "CRO",
          "value": 3.45,
          "unit": "%",
          "observation_date": "2026-09-30",
          "source_label": "东方财富概念板块（Tushare 授权数据）",
          "source_url": "https://data.eastmoney.com/bkzj/"
        }
      ]
    },
    {
      "key": "sentiment",
      "title": "市场温度计",
      "status": "ok",
      "reason": null,
      "points": [
        {
          "label": "流动性",
          "value": 6.1,
          "unit": "观察分",
          "observation_date": "2026-09-30",
          "source_label": "Tushare A股晚报六维观察",
          "source_url": "https://tushare.pro/document/2?doc_id=181"
        },
        {
          "label": "广度",